,Unnamed: 0,timestamp,text,model,review_len,word_count,clean_text
532,532,2020-05-13 23:02:48+00:00,"Samsung Galaxy A30s – Smartphone de 6.4″ Super AMOLED (4 GB RAM, 64 ",samsung,68,13,samsung galaxy smartphone de super amoled gb ram
533,533,2020-05-13 23:02:47+00:00,"Samsung Galaxy A30s – Smartphone de 6.4″ Super AMOLED (4 GB RAM, 64 https://www.ofertagratis.com/samsung-galaxy-a30s-smartphone-de-6-4-super-amoled-4-gb-ram-64-2/",samsung,162,14,samsung galaxy smartphone de super amoled gb ram
534,534,2020-05-13 23:02:44+00:00,"Samsung Galaxy A30s – Smartphone de 6.4″ Super AMOLED (4 GB RAM, 64 GB ROM, 16 MP ultra angular, Dual SIM, versión española) negro ",samsung,131,24,samsung galaxy smartphone de super amoled gb ram gb rom mp ultra angular dual sim versin espaola negro
535,535,2020-05-13 23:02:43+00:00,@samsungmobilemx Samsung: Mi S20 Ultra es una chingonería Su chingonería a loa 5 min de uso.... ,samsung,96,16,samsung mi ultra es una chingonera su chingonera loa min de uso
536,536,2020-05-13 23:02:39+00:00,o samsung ,samsung,10,2,samsung
537,537,2020-05-13 23:02:05+00:00,⁦ ⁩ Samsung GalaXy Note 10+ الثمن 8100 درهم جديد مطرق ⁩ StoCkaGe 256Gb ⁦ ⁩ Ram 12Gb ⁦ ⁩ CPu Exynos 9825 ⁦ ⁩ Caméra 12_12_16/10 ⁦ ⁩ État جديد ⁦ ⁩ Batterie 4300 Maah تسبيق 500 درهم بقيت… https://www.instagram.com/p/CAJU_bVnHQq/?igshid=1viakqtvo4ajw,samsung,246,41,samsung galaxy note stockage gb ram gb cpu exynos camra tat batterie maah
538,538,2020-05-13 23:01:58+00:00,Samsung,samsung,7,1,samsung
539,539,2020-05-13 23:01:54+00:00,jadi selama ini bapak gw pake alarm Samsung Eunha?! jadi buddy aja sekalian deh @GFRDofficial #GFRIEND,samsung,102,16,jadi selama ini bapak gw pake alarm samsung eunha jadi buddy aja sekalian deh gfriend
540,540,2020-05-13 23:01:47+00:00,Samsung Galaxy S7 edge PLUS S8 S6 S5 S4 S3 MINI Camouflage army desert cell phone case cover FREE Shipping Worldwide $5.78 http://rebrand.ly/ljlw93k,samsung,148,23,samsung galaxy edge plus mini camouflage army desert cell phone case cover free shipping worldwide
541,541,2020-05-13 23:01:38+00:00,#bass #earphones Anti-Scratch Tempered Glass Screen Protector for Samsung Galaxy https://volexe.com/anti-scratch-tempered-glass-screen-protector-for-samsung-galaxy/,samsung,164,11,bass earphones antiscratch tempered glass screen protector samsung galaxy
542,542,2020-05-13 23:01:19+00:00,Samsung Galaxy S5 with 2 GB RAM and 16 GB ROM #beezygamer #ninja #business #fitness #iPhone #iPad https://beezygamer.com/samsung-galaxy-s5-with-2-gb-ram-and-16-gb-rom/,samsung,167,18,samsung galaxy gb ram gb rom beezygamer ninja business fitness iphone ipad
543,543,2020-05-13 23:01:07+00:00,"Todos los móviles ya los hacen casi igual, tiene mi hermano un Samsung A70 y se parece bastante a este Huawei en diseño xD.",samsung,123,24,todos los mviles ya los hacen casi igual tiene mi hermano un samsung se parece bastante este huawei en diseo xd
544,544,2020-05-13 23:01:06+00:00,Its funny when the pinks keep using samsung lmao,samsung,48,9,funny pinks keep using samsung lmao
545,545,2020-05-13 23:01:04+00:00,Samsung je les déteste. T’es là en 2016 tu fais des vidéos de moments bien chicos (genre concert de PNL) tu les regardes en 2020 on dirait que c’est une caméra de surveillance qui a filmé une qualiteu vreument !!,samsung,212,40,samsung je les dteste tes l en tu fais des vidos de moments bien chicos genre concert de pnl tu les regardes en dirait que cest une camra de surveillance qui film une qualiteu vreument
546,546,2020-05-13 23:01:03+00:00,"Ich hab das P30 Plus und eines muss ich den Chinesen gegenüber den Koreanern zugestehen: Smartphones bauen können sie (Hard- wie Software topp durchdacht)! Und beim Support, also ehrlich, schlechter als Samsung kann man den Support gar nicht gestalten!",samsung,252,39,ich hab das p plus und eines muss ich den chinesen gegenber den koreanern zugestehen smartphones bauen knnen sie hard wie software topp durchdacht und beim support also ehrlich schlechter als samsung kann man den support gar nicht gestalten
547,547,2020-05-13 23:00:48+00:00,"Powerbank, Battre BB, Iphone, Samsung, BlackBerry BM/Ori/Replika. Info : 22D93ADF / 08192000566 FJB_Bekasi",samsung,106,13,powerbank battre bb iphone samsung blackberry bmorireplika info dadf fjbbekasi
548,548,2020-05-13 23:00:45+00:00,Samsung A71,samsung,11,2,samsung
549,549,2020-05-13 23:00:35+00:00,I think Samsung stop sponsoring them lol because Lisa on Youth with you 2 the computer she used is apple and the AirPods too and they didn’t cover it up,samsung,152,30,think samsung stop sponsoring lol lisa youth computer used apple airpods didnt cover
550,550,2020-05-13 23:00:34+00:00,a galera em choque pq o CEO da xiaomi postou algo em rede social de um iphone gnt paginas oficiais da apple já postaram via android as da samsung já postaram via iphone estagiário só fode geral kkkkkkkkkkkkkkkkkkk,samsung,213,38,galera em choque pq ceo da xiaomi postou algo em rede social de um iphone gnt paginas oficiais da apple j postaram via android da samsung j postaram via iphone estagirio fode geral kkkkkkkkkkkkkkkkkkk
551,551,2020-05-13 23:00:33+00:00,"Yuk Ikutan! Main Game Ramadhan JNE Berhadiah SAMSUNG S20+, Xiaomi Black Shark 2, dll http://dlvr.it/RWbnlc",samsung,106,15,yuk ikutan main game ramadhan jne berhadiah samsung xiaomi black shark dll
552,552,2020-05-13 23:00:32+00:00,"Over time , Samsung software is only uptaded to support for only 2 years and after that there’s no more support. Unlike apple , the iPhone 6s is still using the latest software till this day . Over all apple is a better long lasting phone in my opinion.",samsung,253,49,time samsung software uptaded support years theres support unlike apple iphone still using latest software till day apple better long lasting phone opinion
553,553,2020-05-13 23:00:31+00:00,"Main Game Ramadhan JNE Berhadiah SAMSUNG S20+, Xiaomi Black Shark 2, dll ",samsung,73,12,main game ramadhan jne berhadiah samsung xiaomi black shark dll
554,554,2020-05-13 23:00:09+00:00,This one na leg of Samsung LED TV,samsung,33,8,one na leg samsung led tv
555,555,2020-05-13 23:00:08+00:00,"/rlt/ gaes aku punya budget 4 jutaan, menurut kalian Bagus oppo a92 atau Samsung a31 ya? Atau ada saran lain, oh iya aku ga gunain hp ini buat ngegame kok. Saran nya ya gaes, thank u ",samsung,183,36,rlt gaes aku punya budget jutaan menurut kalian bagus oppo atau samsung ya atau ada saran lain oh iya aku ga gunain hp ini buat ngegame kok saran nya ya gaes thank u
556,556,2020-05-13 23:00:04+00:00,Virtual Warehouse Sale! Shop our website this Saturday during our #WarehouseSale for H U G E savings of up to 70% off http://www.gerhardsappliance.com/virtualwarehousesale.html #ShopLocal #Sale #ApplianceSale #LaundryRoomGoals #KitchenGoals #InteriorDesign #ShopLocal #LG #Samsung #Subzero #Bosch #Remodel,samsung,305,35,virtual warehouse sale shop website saturday warehousesale h u g e savings shoplocal sale appliancesale laundryroomgoals kitchengoals interiordesign shoplocal lg samsung subzero bosch remodel
557,557,2020-05-13 23:00:04+00:00,"sumpa kesel bgt sama orang-orang yang gamau mutualan sama twitter for Android. diketawai sama user samsung s20, klo twitter for iphone mu, iphone 6s LOL",samsung,152,25,sumpa kesel bgt sama orangorang yang gamau mutualan sama twitter android diketawai sama user samsung klo twitter iphone mu iphone lol
558,558,2020-05-13 23:00:02+00:00,Eigene Klingeltöne einstellen mit Samsung Galaxy S3 Android personalisiert. ,samsung,76,9,eigene klingeltne einstellen mit samsung galaxy android personalisiert
559,559,2020-05-13 22:59:55+00:00,#Tecnología - El Samsung Galaxy M21 llega a España: éstos son su precio y disponibilidad #Noticias https://tendencias.tech/el-samsung-galaxy-m21-llega-a-espana-estos-son-su-precio-y-disponibilidad/,samsung,197,17,tecnologa el samsung galaxy llega espaa stos son su precio disponibilidad noticias
560,560,2020-05-13 22:59:51+00:00,"C’est ridicule, surtout avec les téléphones comme Samsung qui sont aussi cher mais bon",samsung,86,14,cest ridicule surtout avec les tlphones comme samsung qui sont aussi cher mais bon
561,561,2020-05-13 22:59:50+00:00,ブログに超貴重なコメント頂きました！米国版のSamsung Payはどうやっても日本での利用不可だそうです（；゜０゜） ,samsung,60,2,samsung pay
562,562,2020-05-13 22:59:46+00:00,"L’administration Trump pousse Intel, TSMC et Samsung à investir aux Etats-Unis ",samsung,79,11,ladministration trump pousse intel tsmc et samsung investir aux etatsunis
563,563,2020-05-13 22:59:45+00:00,Parte de trás do iPhone tirá melhores fotos que as 3 câmaras do meu samsung ,samsung,76,15,parte de trs iphone tir melhores fotos que cmaras meu samsung
564,564,2020-05-13 22:59:39+00:00,eu trabalhando na Samsung e usando xiaomi kkkkk,samsung,47,8,eu trabalhando na samsung e usando xiaomi kkkkk
565,565,2020-05-13 22:59:27+00:00,"Given you pretty much need a smartphone for anything MDE relation, between Apple Pay, google pay, and Samsung pay, I think they got a large percentage covered",samsung,158,27,given pretty much need smartphone anything mde relation apple pay google pay samsung pay think got large percentage covered
566,566,2020-05-13 22:59:26+00:00,"¿Alguien acá con experiencia dándole vida a gadgets viejos? Tengo una tablet Samsung Galaxy Tab 2 10.1, en la que ya no se actualiza nada y quiero ver si puedo meterle otra versión de Android o lo que sea, mientras funcione.",samsung,224,41,alguien ac con experiencia dndole vida gadgets viejos tengo una tablet samsung galaxy tab en la que ya se actualiza nada quiero ver si puedo meterle otra versin de android lo que sea mientras funcione
567,567,2020-05-13 22:59:23+00:00,"""#RIPCapitalism"" says the person with their Apple iPhone, Nike shoes, Samsung TV, Microsoft Xbox, Apple Watch, and air conditioned house with their Macbook or Xbox/Playstation streaming Netflix in the background. Talk about an Oxymoron.",samsung,236,34,ripcapitalism says person apple iphone nike shoes samsung tv microsoft xbox apple watch air conditioned house macbook xboxplaystation streaming netflix background talk oxymoron
568,568,2020-05-13 22:59:22+00:00,Samsung Plegable y PS5 GRATIS!!!! Participo y colaboro con @TecnonautaTV!!!!!!! → https://youtu.be/JUhHvyQZUbo #YouTubersContraCovid19 .,samsung,136,14,samsung plegable ps gratis participo colaboro con youtuberscontracovid
569,569,2020-05-13 22:59:14+00:00,Bu yesil noktayi kim veriyor? iPhone mi? Samsung'u olan ne YAPSIN? Yinede hayirli olsun.,samsung,88,14,bu yesil noktayi kim veriyor iphone mi samsungu olan ne yapsin yinede hayirli olsun
570,570,2020-05-13 22:59:03+00:00,"iphone is so much smother then having a Samsung ,The Camara quality might be better but I’ll rather get a Camara of my own . There’s just so much you can see on social media with a good Camara , like the Camara could be 8k but on social media you could only see 1080p . 1/2",samsung,273,57,iphone much smother samsung camara quality might better ill rather get camara theres much see social media good camara like camara could k social media could see p
571,571,2020-05-13 22:58:54+00:00,"Samsung estou insatisfeita com o meu celular que eu comprei, ele tá desligando do nada e eu acabei de comprar ele, nn entendi porque ele tá assim.",samsung,146,27,samsung estou insatisfeita com meu celular que eu comprei ele desligando nada e eu acabei de comprar ele nn entendi porque ele assim
572,572,2020-05-13 22:58:50+00:00,3 tweets earlier Bad day for Samsung users ,samsung,43,8,tweets earlier bad day samsung users
573,573,2020-05-13 22:58:30+00:00,"Bahhh show, tenho q descobrir como faz isso, peguei o galaxy S6 da Samsung, vem com tecladinho destacável, com o tcl entra no modo Dex e vira um note praticamente, sem o tlc entra em modo android",samsung,195,37,bahhh show tenho q descobrir como faz isso peguei galaxy da samsung vem com tecladinho destacvel com tcl entra modo dex e vira um note praticamente sem tlc entra em modo android
574,574,2020-05-13 22:58:28+00:00,"Powww meu Samsung nn tem mais jeito, tela tá colorida kkkkkkkk",samsung,62,11,powww meu samsung nn tem mais jeito tela colorida kkkkkkkk
575,575,2020-05-13 22:58:25+00:00,"Ich glaube, das meinte er nicht. ReBuy und so zahlen in der Regel auch mehr als 100 EUR für das Vorgängermodell (speziell wenn kaum Gebrauchsspuren drauf sind). Samsung und Co. bieten aber auch direkt 100 EUR Rabatt an, wenn du dein Vorgängermodell ""eintauschst"".",samsung,263,43,ich glaube das meinte er nicht rebuy und zahlen der regel auch mehr als eur fr das vorgngermodell speziell wenn kaum gebrauchsspuren drauf sind samsung und co bieten aber auch direkt eur rabatt wenn du dein vorgngermodell eintauschst
576,576,2020-05-13 22:58:21+00:00,Lebih suka jadi model atau fotografer? Taken by @wayansoya on instagram with Samsung galaxy note 9 https://www.instagram.com/p/CAFOSTJnHeh/?igshid=vbvmsmp6wmh,samsung,158,17,lebih suka jadi model atau fotografer taken instagram samsung galaxy note
577,577,2020-05-13 22:58:17+00:00,"Vendido Celular Samsung J7 prime Preto. Tela zero original, sem marcas de uso. Com caixa e manuais. Cliente: Hugo https://www.instagram.com/p/CAJUjWRpqYqVvUZUqN2ntn-KtsWN-5SG_cSX0Y0/?igshid=xwmo5ckb2nx3",samsung,202,20,vendido celular samsung j prime preto tela zero original sem marcas de uso com caixa e manuais cliente hugo
578,578,2020-05-13 22:58:15+00:00,Samsung Plegable y PS5 GRATIS!!!! Participo y colaboro con @TecnonautaTV!!!!!!! → https://youtu.be/JUhHvyQZUbo #YouTubersContraCovid19,samsung,134,13,samsung plegable ps gratis participo colaboro con youtuberscontracovid
579,579,2020-05-13 22:58:13+00:00,Samsung Gear S3 review: One of the best Smartwatches available today. http://smartwatchgears.com/samsung-gear-s3/ #samsung #watches,samsung,131,14,samsung gear review one best smartwatches available today samsung watches
580,580,2020-05-13 22:58:03+00:00,Samsung overrated af... Android tho;;;;;,samsung,40,5,samsung overrated af android tho
581,581,2020-05-13 22:57:57+00:00,#KBO adding: Samsung Lions +155,samsung,31,5,kbo adding samsung lions
582,582,2020-05-13 22:57:30+00:00,Samsung et Hyundai se tendent la main dans le domaine des véhicules électriques https://www.zdnet.fr/actualites/samsung-et-hyundai-se-tendent-la-main-dans-le-domaine-des-vehicules-electriques-39903641.htm via @zdnetfr,samsung,217,16,samsung et hyundai se tendent la main dans le domaine des vhicules lectriques via
583,583,2020-05-13 22:57:24+00:00,How to make the most out of the Samsung Galaxy S20’s Camera Cape Town Guy http://upflow.co/l/cELH,samsung,97,16,make samsung galaxy ss camera cape town guy
584,584,2020-05-13 22:57:21+00:00,"Macs being aliens to me, I don't know for sure/what upgrades are even possible... But SSD-reliability-wise, in PCs, the Samsung SSD's Puget specs in their systems are the most reliable system component... By a lot... ...",samsung,220,36,macs aliens dont know surewhat upgrades even possible ssdreliabilitywise pcs samsung ssds puget specs systems reliable system component lot
585,585,2020-05-13 22:57:07+00:00,"La línea J de Samsung es la gama media-baja, los iPhone son gama alta",samsung,69,14,la lnea j de samsung es la gama mediabaja los iphone son gama alta
586,586,2020-05-13 22:57:06+00:00,"Wefunix Wireless Car Charger Mount, Automatic Clamping 10W Qi Fast Charging Holder Compatible with iPhone Xs Max XR X 8Plus Samsung S10 S9 S8 S7 Note9 8 QC3.0 Car Charger Included https://bestgpstracker.site/wefunix-wireless-car-charger-mount-automatic-clamping-10w-qi-fast-charging-holder-compatible-with-iphone-xs-max-xr-x-8plus-samsung-s10-s9-s8-s7-note9-8-qc3-0-car-charger-included/",samsung,387,32,wefunix wireless car charger mount automatic clamping w qi fast charging holder compatible iphone xs max xr x plus samsung note qc car charger included
587,587,2020-05-13 22:57:01+00:00,O iphone é mais bonito clr sem duvidas alguma mas o sistema operacional é lógico q é o Samsung o mlr ,samsung,101,21,iphone mais bonito clr sem duvidas alguma mas sistema operacional lgico q samsung mlr
588,588,2020-05-13 22:57:00+00:00,"Vale mano, mas depende muito da marca pq cada uma deixa ou mais carregado ou mais de boa. Samsung msm é dona disso",samsung,114,23,vale mano mas depende muito da marca pq cada uma deixa ou mais carregado ou mais de boa samsung msm dona disso
589,589,2020-05-13 22:56:39+00:00,"I think I might switch to Samsung phone, the iPhone is just bleh now",samsung,68,14,think might switch samsung phone iphone bleh
590,590,2020-05-13 22:56:36+00:00,"Oh.. the earbuds paired to Galaxy Note10 and the music apps used were Samsung's native music app, Amazon Music and Spotify.",samsung,123,21,oh earbuds paired galaxy note music apps used samsungs native music app amazon music spotify
591,591,2020-05-13 22:56:36+00:00,"Oi, Let. Pra ter ajuda com seu pedido feito no site da Samsung, dá uma ligadinha no 0800-942-9060 em horário comercial que eles vão te ajudar, viu? ",samsung,148,27,oi let pra ter ajuda com seu pedido feito site da samsung uma ligadinha em horrio comercial que eles vo te ajudar viu
592,592,2020-05-13 22:56:32+00:00,"Global 5G Chipset Market 2020 Trending vendors – Qualcomm, Intel, Nokia, Samsung, Xilinx | Impact of COVID-19 - Galus Australis ",samsung,128,20,global g chipset market trending vendors qualcomm intel nokia samsung xilinx impact covid galus australis
593,593,2020-05-13 22:56:15+00:00,Jangan pernah berhenti untuk berdoa Taken by @shaum.motret on instagram with Samsung galaxy a10 https://www.instagram.com/p/CAIG_e2H1Au/?igshid=b9c2jaj0anp1,samsung,156,15,jangan pernah berhenti untuk berdoa taken motret instagram samsung galaxy
594,594,2020-05-13 22:56:14+00:00,Hp SuperCopy Samsung Galaxy Note3 5.7 Universal Pen Besi Rp 1.500.000 More Info Pin :7FBD640F,samsung,93,15,hp supercopy samsung galaxy note universal pen besi rp info pin fbdf
595,595,2020-05-13 22:56:14+00:00,Comprou um Samsung amiga?,samsung,25,4,comprou um samsung amiga
596,596,2020-05-13 22:56:10+00:00,"I have upgraded and got myself a smartwatch. A Samsung Galaxy Active 2. I had a Fitbit Charge 2 and thought it was pretty great but this is a whole new world for me. lol. I mean, I'm showing my age here, but what the samsung smartwatch can do simply blows my mind. Its amazing.",samsung,277,55,upgraded got smartwatch samsung galaxy active fitbit charge thought pretty great whole new world lol mean im showing age samsung smartwatch simply blows mind amazing
597,597,2020-05-13 22:56:08+00:00,Tempered Protective Glass Film for Samsung Galaxy #phone #onlineshop https://flashtechshop.com/product/tempered-protective-glass-film-for-samsung-galaxy/,samsung,153,10,tempered protective glass film samsung galaxy phone onlineshop
598,598,2020-05-13 22:56:07+00:00,Geladeira Samsung French Door 530 Litros Inox 110V RF23R6301SR/AZ Alimentos frescos por muito mais tempo Twin Cooling Plus Garanta que seus alimentos estejam frescos por mais tempo*. O Twin Cooling Plus otimiza a temperatura e a umidade da geladeira e do freezer,samsung,262,42,geladeira samsung french door litros inox v rfrsraz alimentos frescos por muito mais tempo twin cooling plus garanta que seus alimentos estejam frescos por mais tempo twin cooling plus otimiza temperatura e umidade da geladeira e freezer
599,599,2020-05-13 22:56:02+00:00,Strategy Analytics: Samsung Galaxy A51 is World's Bestselling Android Smartphone Model in Q1 2020 - Olean Times Herald http://dlvr.it/RWbnG7,samsung,140,19,strategy analytics samsung galaxy worlds bestselling android smartphone model q olean times herald
600,600,2020-05-13 22:55:53+00:00,"Huawei GT Watch 2 , Fossil Q explorist Gen 5 , Samsung Galaxy Active 2 (en el mismo orden)",samsung,90,19,huawei gt watch fossil q explorist gen samsung galaxy active en el mismo orden
601,601,2020-05-13 22:55:50+00:00,a anitta com a samsung ,samsung,23,5,anitta com samsung
602,602,2020-05-13 22:55:47+00:00,Da Samsung ainda kkkkkk,samsung,23,4,da samsung ainda kkkkkk
603,603,2020-05-13 22:55:45+00:00,"Sir Ek maasoom bhakt ki kalam se, Jo Log apple, samsung, oppo , Vivo ; Huawei mein naukri kar rahe hain. Kya woh bhi apni Naukri tyaag de. Hye re ye kya keh diya modi ji ne. Aur apna business start kare. Loan mil raha hai bhakto. Please aatmnirbhar bano. ",samsung,255,50,sir ek maasoom bhakt ki kalam se jo log apple samsung oppo vivo huawei mein naukri kar rahe hain kya woh bhi apni naukri tyaag de hye ye kya keh diya modi ji ne aur apna business start kare loan mil raha hai bhakto please aatmnirbhar bano
604,604,2020-05-13 22:55:38+00:00,"because we a ""samsung family"" and it costs extra to switch stuff i think idek bro",samsung,81,16,samsung family costs extra switch stuff think idek bro
605,605,2020-05-13 22:55:26+00:00,Solo escucho mucho Samsung y Apple. Jajajajajajajajaja,samsung,54,7,solo escucho mucho samsung apple jajajajajajajajaja
606,606,2020-05-13 22:55:26+00:00,Samsung vs Lg vs Huawei vs xiaomi battery charge testing https://youtu.be/ACi8dciPLGk via @YouTube,samsung,98,13,samsung vs lg vs huawei vs xiaomi battery charge testing via
607,607,2020-05-13 22:55:20+00:00,Alguém tbm sofre com carregador novo dos Samsung?,samsung,49,8,algum tbm sofre com carregador novo dos samsung
608,608,2020-05-13 22:55:14+00:00,"Samsung, bes.",samsung,13,2,samsung bes
609,609,2020-05-13 22:55:13+00:00,"samsung s20 i'm coming lah ya anjay bismillah :""",samsung,48,9,samsung im coming lah ya anjay bismillah
610,610,2020-05-13 22:55:11+00:00,"[asking] ada yang pake samsung A10 atau ip 6+/6s+ ga? dom medan ya. aku punya case hpnya masih baru dan ga ke pake,sayang soalnya kalo dipendam terus",samsung,149,27,asking ada yang pake samsung atau ip ga dom medan ya aku punya case hpnya masih baru dan ga ke pakesayang soalnya kalo dipendam terus
611,611,2020-05-13 22:55:10+00:00,How to make the most out of the Samsung Galaxy S20’s Camera Cape Town Guy http://upflow.co/l/2DXN,samsung,97,16,make samsung galaxy ss camera cape town guy
612,612,2020-05-13 22:54:26+00:00,bp and bts suck at promoting samsung lmao,samsung,41,8,bp bts suck promoting samsung lmao
613,613,2020-05-13 22:54:25+00:00,y don’t u just get a new Samsung,samsung,32,8,dont u get new samsung
614,614,2020-05-13 22:54:17+00:00,تم تحديث تطبيق SHAHID الخاص أجهزة LG و Samsung، الرجاء التأكد من تحديث التطبيق واستخدام آخر اصدار من التطبيق وفي حال تواجهك أي مشكلة في التطبيق الرجاء إرسال صورة أو فيديو من الخطأ الظاهر لنتمكن من مساعدتك بشكل أفضل ملاحظة متعلقة بمستخدمي SAMSUNG - نحن ندعم فقط Samsung Tizen TV,samsung,277,50,shahid lg samsung samsung samsung tizen tv
615,615,2020-05-13 22:54:06+00:00,La pantalla de los Samsung son hermosas ,samsung,40,7,la pantalla de los samsung son hermosas
616,616,2020-05-13 22:54:03+00:00,How to make the most out of the Samsung Galaxy S20’s Camera Cape Town Guy http://upflow.co/l/2KGW,samsung,97,16,make samsung galaxy ss camera cape town guy
617,617,2020-05-13 22:53:37+00:00,omw to get a samsung for bts concerts only,samsung,42,9,omw get samsung bts concerts
618,618,2020-05-13 22:53:34+00:00,"Sir masoom bhakt pooch rhe hain ? Ek masoom bhakt ki kalam se, Jo Log apple,samsung,oppo,Vivo ; Huawei mein naukri kar rhe hain. Kya woh bhi apni Naukri tyaag de. Hye re ye kya keh diya modi ji ne. Aur apna business start kare. Loan mil rha hai bhakto. Please aatmnirbhar bano. ",samsung,278,52,sir masoom bhakt pooch rhe hain ek masoom bhakt ki kalam se jo log applesamsungoppovivo huawei mein naukri kar rhe hain kya woh bhi apni naukri tyaag de hye ye kya keh diya modi ji ne aur apna business start kare loan mil rha hai bhakto please aatmnirbhar bano
619,619,2020-05-13 22:53:24+00:00,I have the samsung s20+ which has better specs than the 11 ,samsung,59,12,samsung better specs
620,620,2020-05-13 22:53:14+00:00,Apple > Samsung | any day ,samsung,26,6,apple samsung day
621,621,2020-05-13 22:53:03+00:00,Over the horizon #samsunggalaxynote9 #samsung #mobilephotography #kualalumpur #malaysia #asia #total_asia #pixelandlens #tourism #nosmallcreator #sunrise #cyberjaya @Cyberjaya https://www.instagram.com/p/CAJT9R5HRmo/?igshid=r4abkf47z14b,samsung,236,17,horizon samsunggalaxynote samsung mobilephotography kualalumpur malaysia asia totalasia pixelandlens tourism nosmallcreator sunrise cyberjaya
622,622,2020-05-13 22:53:02+00:00,"Цена, рендеры и характеристики Samsung Galaxy A21s: дебют Exynos 850 ",samsung,69,10,samsung galaxy exynos
623,623,2020-05-13 22:52:59+00:00,Cambie de cel a un Motorola y ya estoy extrañando la cámara de Samsung (en selfie) ,samsung,83,16,cambie de cel un motorola ya estoy extraando la cmara de samsung en selfie
624,624,2020-05-13 22:52:52+00:00,5.99 with code 70PTY2GG https://www.amazon.com/dp/B07YYHZ5YQ/?tag=lpd-twitter-20 Micro USB Cable HaoKande 4Color 4Pack 4FT High Speed Nylon Braided Android Charger Cable Compatible for Samsung Galaxy ,samsung,200,23,code ptygg micro usb cable haokande color pack ft high speed nylon braided android charger cable compatible samsung galaxy
625,625,2020-05-13 22:52:51+00:00,#cooperation between .@Hyundai_Global ; Samsung WDB interesting .@AmazingChevVolt .@arikring .@Autoline .@MunroAssociates .@TheEconomist .@FT .@NAR Is #Hyundai getting serious about #bEVs .@sfchronicle .@nytimes .@nytimes .@handelsblatt .@FT .@BW .@BloombergNEF .@NuovaRealta,samsung,275,28,cooperation global samsung wdb interesting hyundai getting serious bevs
