,Unnamed: 0,timestamp,text,model,review_len,word_count,clean_text
1478,1478,2020-05-13 21:29:25+00:00,Iphone ile android i kiyaslamaniz yanlis. Android bir telefon markasi degil yazilimdir. Android ve Ios derseniz dogru olur. Ayrica dunyanin en iyi telefonu Samsung S ve Note serileridir. Kapiş ,samsung,193,29,iphone ile android kiyaslamaniz yanlis android bir telefon markasi degil yazilimdir android ios derseniz dogru olur ayrica dunyanin en iyi telefonu samsung note serileridir kapi
1479,1479,2020-05-13 21:29:23+00:00,"El panel samsung es tremendo, muy bueno y nítido",samsung,48,9,el panel samsung es tremendo muy bueno ntido
1480,1480,2020-05-13 21:29:14+00:00,"aah, é que nem samsung, obg anjo!!",samsung,34,7,aah que nem samsung obg anjo
1481,1481,2020-05-13 21:29:08+00:00,CUPOM SMARTPHONES MOTOROLA MOTO G - SAMSUNG GALAXY - IPHONE - LG - COM ATÉ 70% DE DESCONTO + CASHBACK! ACESSE: https://amzn.to/34mdWer,samsung,134,22,cupom smartphones motorola moto g samsung galaxy iphone lg com de desconto cashback acesse
1482,1482,2020-05-13 21:29:08+00:00,CUPOM SMARTPHONES MOTOROLA MOTO G - SAMSUNG GALAXY - IPHONE - LG - COM ATÉ 70% DE DESCONTO + CASHBACK! ACESSE: https://amzn.to/34mdWer,samsung,134,22,cupom smartphones motorola moto g samsung galaxy iphone lg com de desconto cashback acesse
1483,1483,2020-05-13 21:29:08+00:00,This is a big effing monitor! Samsung 49 inch QLED 5120X1440. 16” MacBook Pro for scale. ,samsung,89,16,big effing monitor samsung inch qled x macbook pro scale
1484,1484,2020-05-13 21:29:08+00:00,CUPOM SMARTPHONES MOTOROLA MOTO G - SAMSUNG GALAXY - IPHONE - LG - COM ATÉ 70% DE DESCONTO + CASHBACK! ACESSE: https://amzn.to/34mdWer,samsung,134,22,cupom smartphones motorola moto g samsung galaxy iphone lg com de desconto cashback acesse
1485,1485,2020-05-13 21:29:08+00:00,CUPOM SMARTPHONES MOTOROLA MOTO G - SAMSUNG GALAXY - IPHONE - LG - COM ATÉ 70% DE DESCONTO + CASHBACK! ACESSE: https://amzn.to/34mdWer,samsung,134,22,cupom smartphones motorola moto g samsung galaxy iphone lg com de desconto cashback acesse
1486,1486,2020-05-13 21:29:07+00:00,CUPOM SMARTPHONES MOTOROLA MOTO G - SAMSUNG GALAXY - IPHONE - LG - COM ATÉ 70% DE DESCONTO + CASHBACK! ACESSE: https://amzn.to/34mdWer,samsung,134,22,cupom smartphones motorola moto g samsung galaxy iphone lg com de desconto cashback acesse
1487,1487,2020-05-13 21:29:04+00:00,The older model of the Samsung Galaxy Note 20 line will be smaller than the Galaxy S20 Ultra https://targetyoutube.com/galaxy-note-20-model-smaller-galaxy-s20-ultra/ #Samsung #GalaxyNote20 #GalaxyNote20Plus #GalaxyS20Ultra #Older #Model #GalaxyNote20Line,samsung,254,26,older model samsung galaxy note line smaller galaxy ultra samsung galaxynote galaxynoteplus galaxysultra older model galaxynoteline
1488,1488,2020-05-13 21:29:02+00:00,"2019 Samsung Galaxy Tab A 10.1-inch Touchscreen (1920×1200) Wi-Fi Tablet Bundle, Exynos 7904A Processor, 2GB RAM, 32GB Memory, BMali-G71 MP2 Graphics, Bluetooth, Tigology Case, Android 9.0, Silver ",samsung,197,27,samsung galaxy tab inch touchscreen wifi tablet bundle exynos processor gb ram gb memory bmalig mp graphics bluetooth tigology case android silver
1489,1489,2020-05-13 21:28:48+00:00,"Lo logramos ELF's, cumpleaños de nuestro principito! En Ídol Champ, si se pudo!! Tendremos el anuncio mas grande en la estación Samsung durante todo el mes de Junio! Entramos en modo recolección #Ryeowook #슈퍼주니어 @SJofficial #SUPERJUNIOR",samsung,236,36,lo logramos elfs cumpleaos de nuestro principito en dol champ si se pudo tendremos el anuncio mas grande en la estacin samsung durante todo el mes de junio entramos en modo recoleccin ryeowook superjunior
1490,1490,2020-05-13 21:28:45+00:00,Samsung fans see news about new Exynos chipsets https://twitter.com/gsmarena_com/status/1260680224250814464,samsung,107,9,samsung fans see news new exynos chipsets
1491,1491,2020-05-13 21:28:44+00:00,Samsung SmartThings Hub Setup https://is.gd/GMeDhx #howtos,samsung,58,6,samsung smartthings hub setup howtos
1492,1492,2020-05-13 21:28:43+00:00,"Reloj inteligente Samsung | Reloj Inteligente - Actualmente la compañía surcoreana posee dos nuevos dispositivos en el mercado. El Samsung Galaxy Watch Active 2 es el más reciente, la segunda generación ",samsung,203,31,reloj inteligente samsung reloj inteligente actualmente la compaa surcoreana posee dos nuevos dispositivos en el mercado el samsung galaxy watch active es el ms reciente la segunda generacin
1493,1493,2020-05-13 21:28:37+00:00,"Você chegou a realizar os testes de bateria presentes no Samsung Members, Robert?",samsung,81,13,voc chegou realizar os testes de bateria presentes samsung members robert
1494,1494,2020-05-13 21:28:31+00:00,Samsung is android-,samsung,19,3,samsung android
1495,1495,2020-05-13 21:28:30+00:00,Samsung Qi Certified Fast Charge Wireless Charging Pad + Stand - Supports wireless charging on Qi compatible smartphones - Black https://amzn.to/39RrfoA,samsung,152,21,samsung qi certified fast charge wireless charging pad stand supports wireless charging qi compatible smartphones black
1496,1496,2020-05-13 21:28:29+00:00,samsung a8 2018 #TREASUREisCOMING #TREASURE_DEBUT_ON_JULY @ygtreasuremaker #TREASURE,samsung,84,7,samsung treasureiscoming treasuredebutonjuly treasure
1497,1497,2020-05-13 21:28:25+00:00,samsung s20,samsung,11,2,samsung
1498,1498,2020-05-13 21:28:19+00:00,"Samsung podría lanzar un Galaxy Fold Lite barato con 4G, ¡por fin! https://ift.tt/2WuHRyO",samsung,89,13,samsung podra lanzar un galaxy fold lite barato con g por fin
1499,1499,2020-05-13 21:28:15+00:00,R u on Android or Samsung?,samsung,26,6,r u android samsung
1500,1500,2020-05-13 21:28:12+00:00,ew tanjirou pakai samsung ,samsung,26,4,ew tanjirou pakai samsung
1501,1501,2020-05-13 21:28:12+00:00,U could easily swap to an iPhone or Samsung.... and get beter specks,samsung,68,13,u could easily swap iphone samsung get beter specks
1502,1502,2020-05-13 21:28:10+00:00,ฉันได้วาดไว้ด้วย samsung SM-T825Y และ ไอบิสเพนท์ X: 'fruityfresh' ,samsung,66,7,samsung smty x fruityfresh
1503,1503,2020-05-13 21:27:57+00:00,"To me sentindo tão feio, só a câmera de um Samsung pra aumentar minha autoestima.",samsung,81,15,sentindo feio cmera de um samsung pra aumentar minha autoestima
1504,1504,2020-05-13 21:27:51+00:00,Es una Samsung,samsung,14,3,es una samsung
1505,1505,2020-05-13 21:27:51+00:00,Samsung ,samsung,8,1,samsung
1506,1506,2020-05-13 21:27:51+00:00,"@BulbUK I joint bulb thinking I was getting an offer when I joined this has not happened, it was an option of account credit of £50, cash back from cash back sites or get a Samsung smartthings hub for £1. I opted for the smartthings and guess I am not getting this messed about.",samsung,278,54,joint bulb thinking getting offer joined happened option account credit cash back cash back sites get samsung smartthings hub opted smartthings guess getting messed
1507,1507,2020-05-13 21:27:46+00:00,Huawei p smart 2019 i Samsung a20e,samsung,34,7,huawei p smart samsung ae
1508,1508,2020-05-13 21:27:46+00:00,"Thanks, I try. I still don't have automatic call screen (here in Canada), no RCS, nor the new assistant UI. So if the cameras aren't amazing, why bother sticking with Pixel phones. I can get decent updates via OnePlus, even Samsung now (to a degree) ; obviously on iPhones.",samsung,273,49,thanks try still dont automatic call screen canada rcs new assistant ui cameras arent amazing bother sticking pixel phones get decent updates via oneplus even samsung degree obviously iphones
1509,1509,2020-05-13 21:27:40+00:00,"Cos it's cheaper, it's sleek, and and it's android and besides Samsung produces parts for iPhone , which means I can't produce something for you and yours is better than mine.",samsung,175,31,cos cheaper sleek android besides samsung produces parts iphone means cant produce something better mine
1510,1510,2020-05-13 21:27:32+00:00,"Eu pago pau pra samsung com orgulho, Iphone e Xiaomi é minha rola",samsung,65,13,eu pago pau pra samsung com orgulho iphone e xiaomi minha rola
1511,1511,2020-05-13 21:27:24+00:00,Samsung Plegable y PS5 GRATIS!!!! Participo y colaboro con @TecnonautaTV!!!!!!! → https://youtu.be/JUhHvyQZUbo #YouTubersContraCovid19,samsung,134,13,samsung plegable ps gratis participo colaboro con youtuberscontracovid
1512,1512,2020-05-13 21:27:20+00:00,Teléfono Plegable de Samsung y PS5 GRATIS ¿Te apuntas a este sorteo benéfico? ,samsung,78,13,telfono plegable de samsung ps gratis te apuntas este sorteo benfico
1513,1513,2020-05-13 21:27:20+00:00,"A Nestlé pelo que sei fode a natureza em níveis insanos mas não tem quem não tenha algo dela em casa, ou de alguma filial. Ou mesmo de uma concorrente que faz o mesmo tipo de merda. O mesmo vale pro iPhone. Compra um Samsung e depois pesquisa sobre as fábricas e vê que é uma merd",samsung,280,57,nestl pelo que sei fode natureza em nveis insanos mas tem quem tenha algo dela em casa ou de alguma filial ou mesmo de uma concorrente que faz mesmo tipo de merda mesmo vale pro iphone compra um samsung e depois pesquisa sobre fbricas e v que uma merd
1514,1514,2020-05-13 21:27:11+00:00,"Io ho sempre avuto apple io mio ragazzo sempre Samsung, indovinate chi fotte prima la batteria perché ci scarica mille giochini? Dipende da come li usate i cellulari... Comunque tutti i brand sono fatti per durare poco volutamente.",samsung,231,38,io ho sempre avuto apple io mio ragazzo sempre samsung indovinate chi fotte prima la batteria perch ci scarica mille giochini dipende da come li usate cellulari comunque tutti brand sono fatti per durare poco volutamente
1515,1515,2020-05-13 21:27:11+00:00,Samsung,samsung,7,1,samsung
1516,1516,2020-05-13 21:27:00+00:00,38% Off!! Samsung Electronics R7070 Robot Vacuum Self-cleaning Brush for Pet Hair https://amzn.to/2UULtcJ #BwcDeals #dailydeals #DealsAndSteals,samsung,143,16,samsung electronics r robot vacuum selfcleaning brush pet hair bwcdeals dailydeals dealsandsteals
1517,1517,2020-05-13 21:27:00+00:00," Samsung Galaxy S20+, análisis: todo lo bueno de la experiencia ""Ultra"" en un tamaño mucho más acertado #ZirigozaGroup #marketing #SEO ",samsung,135,20,samsung galaxy anlisis todo lo bueno de la experiencia ultra en un tamao mucho ms acertado zirigozagroup marketing seo
1518,1518,2020-05-13 21:26:59+00:00,Ahhahhaha padek ...dulu last main sim kat samsung corby bhai .. ahhah version² bru ni tk try lgi,samsung,96,18,ahhahhaha padek dulu last main sim kat samsung corby bhai ahhah version bru ni tk try lgi
1519,1519,2020-05-13 21:26:53+00:00,Samsung galaxy S20.... Mucho más que cualquiera de esos dos,samsung,59,10,samsung galaxy mucho ms que cualquiera de esos dos
1520,1520,2020-05-13 21:26:42+00:00,"Je suis sûre que ce tweet passera totalement inaperçu mais, il y a des utilisateurs de Samsung Health dans ma TL ? On pourrait s'ajouter pour faire des petits défis ! ",samsung,167,31,je suis sre que ce tweet passera totalement inaperu mais il des utilisateurs de samsung health dans tl pourrait sajouter pour faire des petits dfis
1521,1521,2020-05-13 21:26:41+00:00,Samsung ,samsung,8,1,samsung
1522,1522,2020-05-13 21:26:16+00:00,"Setdah:"") kak abin panutanku, orkay hp samsung:) tp samsung emang bagus si",samsung,74,12,setdah kak abin panutanku orkay hp samsung tp samsung emang bagus si
1523,1523,2020-05-13 21:26:13+00:00,"Hi @Streamdays why can't I hear audio on the @1EileanDonan webcam on my phone? Works fine on my laptop! I had geese,cuckoos and even an eagle but nowt on my Samsung :-(",samsung,168,32,hi cant hear audio webcam phone works fine laptop geesecuckoos even eagle nowt samsung
1524,1524,2020-05-13 21:26:05+00:00,16GB Samsung PC4-2400T-R ECC RDIMM Server Memory RAM M393A2G40EB1-CRC0Q ,samsung,72,9,gb samsung pctr ecc rdimm server memory ram magebcrcq
1525,1525,2020-05-13 21:26:02+00:00,"Reloj inteligente Samsung | Reloj Inteligente - Actualmente la compañía surcoreana posee dos nuevos dispositivos en el mercado. El Samsung Galaxy Watch Active 2 es el más reciente, la segunda generación ",samsung,203,31,reloj inteligente samsung reloj inteligente actualmente la compaa surcoreana posee dos nuevos dispositivos en el mercado el samsung galaxy watch active es el ms reciente la segunda generacin
1526,1526,2020-05-13 21:26:01+00:00,"Me viro muito bem com um iPhone 5 antiguinho, mas que tá dando sinais de cansaço. Se eu fosse me endividar comprando um celular novo, qual seria o melhor custo-beneficio? Motorola presta? LG, Samsung? Ajudem esse leigo em telefonia, por favor.",samsung,243,41,viro muito bem com um iphone antiguinho mas que dando sinais de cansao se eu fosse endividar comprando um celular novo qual seria melhor custobeneficio motorola presta lg samsung ajudem esse leigo em telefonia por favor
1527,1527,2020-05-13 21:25:59+00:00,se eh por 8 mil compro o samsung que dobra no meio,samsung,50,12,se eh por mil compro samsung que dobra meio
1528,1528,2020-05-13 21:25:45+00:00,"Nossa, surreal! Nunca mais compro lá! Primeira vez que compro produtos da Samsung e só tô passando raiva",samsung,104,18,nossa surreal nunca mais compro l primeira vez que compro produtos da samsung e passando raiva
1529,1529,2020-05-13 21:25:31+00:00,"Enter to win this competition: Samsung 65"" LED Smart 4K Ultra HD TV Giveaway ",samsung,77,14,enter win competition samsung led smart k ultra hd tv giveaway
1530,1530,2020-05-13 21:25:18+00:00,"Ooooh, I went for the Samsung 49 curved.",samsung,40,8,ooooh went samsung curved
1531,1531,2020-05-13 21:25:16+00:00,Hi Alok! #boston,samsung,16,3,hi alok boston
1532,1532,2020-05-13 21:25:05+00:00,Samsung,samsung,7,1,samsung
1533,1533,2020-05-13 21:25:02+00:00,"Tá, talvez eu queira um celular dobrável da Samsung.",samsung,52,9,talvez eu queira um celular dobrvel da samsung
1534,1534,2020-05-13 21:24:52+00:00,"Los de Samsung también, jajaja",samsung,30,5,los de samsung tambin jajaja
1535,1535,2020-05-13 21:24:46+00:00,King of Samsung,samsung,15,3,king samsung
1536,1536,2020-05-13 21:24:44+00:00,kisne keh diya Samsung kay Cameras achay nahi hai Samsung bhi Android hi ha :P,samsung,78,15,kisne keh diya samsung kay cameras achay nahi hai samsung bhi android hi ha p
1537,1537,2020-05-13 21:24:42+00:00,Samsung 108 MP Kamera Sensörüne Yakından Bakın https://www.severteknoloji.com/samsung-108-mp-kamera-sensorune-yakindan-bakin/,samsung,125,8,samsung mp kamera sensrne yakndan bakn
1538,1538,2020-05-13 21:24:41+00:00,"The new ""normal"" has begun & we want you to be a BOSS when it comes to working at home. #TeamGalaxy creators @ColinandSamir are here to teach you about connecting your #Galaxy device to a Monitor or TV using Samsung Dex, ; also creating content from home. ",samsung,256,47,new normal begun want boss comes working home teamgalaxy creators teach connecting galaxy device monitor tv using samsung dex also creating content home
1539,1539,2020-05-13 21:24:39+00:00,Teléfono Plegable de Samsung y PS5 GRATIS ¿Te apuntas a este sorteo benéfico? ,samsung,78,13,telfono plegable de samsung ps gratis te apuntas este sorteo benfico
1540,1540,2020-05-13 21:24:36+00:00,"elas ficaram tão caladas depois que tocou a notificação do iphone e eu só imagino elas pensando ""puta que pariu esqueci de colocar no silencioso esta PORRA vão encher nosso saco de novo com esse caralho de samsung todo dia isso"" ",samsung,229,41,elas ficaram caladas depois que tocou notificao iphone e eu imagino elas pensando puta que pariu esqueci de colocar silencioso esta porra vo encher nosso saco de novo com esse caralho de samsung todo dia isso
1541,1541,2020-05-13 21:24:34+00:00,"@Lowes your samsung vendor is awful,repair company told me that they were not interested in looking at my 8 month old Samsung range after I told him what happened to it. Said it would need to be replaced but that Samsung pays someone to do nothing but deny replacement claims.",samsung,276,50,samsung vendor awfulrepair company told interested looking month old samsung range told happened said would need replaced samsung pays someone nothing deny replacement claims
1542,1542,2020-05-13 21:24:33+00:00,Samsung 3d scanner does not care.,samsung,33,6,samsung scanner care
1543,1543,2020-05-13 21:24:30+00:00,"nak menang giveeeawayy sebab nak hadiahkan to my mother sempena birthday dia , kesian tengok pakai samsung lama ja ",samsung,115,19,nak menang giveeeawayy sebab nak hadiahkan mother sempena birthday dia kesian tengok pakai samsung lama ja
1544,1544,2020-05-13 21:24:20+00:00,New phone Samsung galaxy S20 Ultra ,samsung,35,6,new phone samsung galaxy ultra
1545,1545,2020-05-13 21:24:14+00:00,Tipo airpods o samsung me van bien,samsung,34,7,tipo airpods samsung van bien
1546,1546,2020-05-13 21:24:08+00:00,I can’t stand them is it really that hars to switch to samsung ,samsung,63,13,cant stand really hars switch samsung
1547,1547,2020-05-13 21:24:08+00:00,Teléfono Plegable de Samsung y PS5 GRATIS ¿Te apuntas a este sorteo benéfico? ,samsung,78,13,telfono plegable de samsung ps gratis te apuntas este sorteo benfico
1548,1548,2020-05-13 21:24:01+00:00,[Short Tip] Quickly copy files to Samsung Galaxy S20+ on Fedora 32 ,samsung,67,12,short tip quickly copy files samsung galaxy fedora
1549,1549,2020-05-13 21:23:46+00:00,http://t.me/CoinExOfficialBot?start=1125532455 Hurry and join,samsung,61,4,hurry join
1550,1550,2020-05-13 21:23:41+00:00,poxa essa era a hora do teteco me doar o antigo iphone dele já que ele mudou pro samsung ,samsung,89,19,poxa essa era hora teteco doar antigo iphone dele j que ele mudou pro samsung
1551,1551,2020-05-13 21:23:40+00:00,Teléfono Plegable de Samsung y PS5 GRATIS ¿Te apuntas a este sorteo benéfico? https://wn.nr/cgZgxP,samsung,98,14,telfono plegable de samsung ps gratis te apuntas este sorteo benfico
1552,1552,2020-05-13 21:23:19+00:00,自分が使ってるスマホ Androidスマホで Samsung（韓国製）GalaxyS10と言うの使っています笑 物凄く癖あります笑,samsung,65,4,android samsunggalaxys
1553,1553,2020-05-13 21:23:17+00:00,Pokoknya bisa buat beli handphone samsung a51 aja,samsung,49,8,pokoknya bisa buat beli handphone samsung aja
1554,1554,2020-05-13 21:23:15+00:00,"Reloj inteligente Samsung | Reloj Inteligente - Actualmente la compañía surcoreana posee dos nuevos dispositivos en el mercado. El Samsung Galaxy Watch Active 2 es el más reciente, la segunda generación ",samsung,203,31,reloj inteligente samsung reloj inteligente actualmente la compaa surcoreana posee dos nuevos dispositivos en el mercado el samsung galaxy watch active es el ms reciente la segunda generacin
1555,1555,2020-05-13 21:23:07+00:00,Ofertaca en Amazon para este pepino de TV Samsung UE55RU8005 que tan buena puntuación tiene en @rtingsdotcom Link para compra https://amzn.to/2WwhpFc Si queréis ver una señora review de ella os dejo enlace https://www.rtings.com/tv/reviews/samsung/ru8000,samsung,254,33,ofertaca en amazon para este pepino de tv samsung ueru que tan buena puntuacin tiene en link para compra si queris ver una seora review de ella os dejo enlace
1556,1556,2020-05-13 21:23:06+00:00,"If ur looking for a cheaper option, I asked for Samsung galaxy buds+ for my birthday this year ; they’re just as awesome at a lil less than the cost of AirPods. I do have an iPhone and they work perfectly. Plus they have different size ear cushions so u can adjust to ur ears",samsung,275,55,ur looking cheaper option asked samsung galaxy buds birthday year theyre awesome lil less cost airpods iphone work perfectly plus different size ear cushions u adjust ur ears
1557,1557,2020-05-13 21:23:05+00:00,Samsung mbok,samsung,12,2,samsung mbok
1558,1558,2020-05-13 21:23:03+00:00,"Maaf, permintaan anda tidak dikenal. Mohon cek kembali. Hubungi 264 untuk bantuan lebih lanjut Info Promo: Nonton Scene RAHASIA Film DILAN 1990&1991. Raih Samsung Note10+. Hub *500*60#",samsung,184,27,maaf permintaan anda tidak dikenal mohon cek kembali hubungi untuk bantuan lebih lanjut info promo nonton scene rahasia film dilan raih samsung note hub
1559,1559,2020-05-13 21:22:53+00:00,a parte do Samsung é a melhor KKKKKKKKKKKKK,samsung,43,8,parte samsung melhor kkkkkkkkkkkkk
1560,1560,2020-05-13 21:22:53+00:00,"qual foi binha tudo que eu faço pra você nunca tá bom se tiver achando ruim contrate um fotógrafo hm faça uma plástica hm e fica tudo certo você já viu princesa fazer plástica? e você já viu samsung fazer ma gi ca? não, mas eu já vi pau de selfie tirar foto boa",samsung,261,54,qual foi binha tudo que eu fao pra voc nunca bom se tiver achando ruim contrate um fotgrafo hm faa uma plstica hm e fica tudo certo voc j viu princesa fazer plstica e voc j viu samsung fazer gi ca mas eu j vi pau de selfie tirar foto boa
1561,1561,2020-05-13 21:22:52+00:00,"Seriously, you need to fix this. I'm losing an app every week on my tablet. This business model is shameless. You can't charge people a fortune & then fail to support properly by not updating software. I thought apple took the piss out of its customers, it seems Samsung do too ",samsung,278,51,seriously need fix im losing app every week tablet business model shameless cant charge people fortune fail support properly updating software thought apple took piss customers seems samsung
1562,1562,2020-05-13 21:22:46+00:00,"Mi mamá después de tener un Samsung grand neo, x 5 años y echo bolsa. Hoy x fin tiene cel nuevo, y me genera tanta emoción. Xq deja sus gustos, x complacernos a nosotros",samsung,169,34,mi mam despus de tener un samsung grand neo x aos echo bolsa hoy x fin tiene cel nuevo genera tanta emocin xq deja sus gustos x complacernos nosotros
1563,1563,2020-05-13 21:22:32+00:00,"Compra feita dia 9, sumiu do site dia 11 (consta que não há pedidos feitos). 0800 da Samsung fora do ar devido ao COVID. Perfil da @SamsungBrasil não sabe de nada. Nenhuma atualização por e-mail desde então...",samsung,209,37,compra feita dia sumiu site dia consta que h pedidos feitos da samsung fora ar devido ao covid perfil da sabe de nada nenhuma atualizao por email desde ento
1564,1564,2020-05-13 21:22:28+00:00,Sila diperbarui dan menikmati pembaruan sistem operasi terakhir untuk Samsung J6.,samsung,81,11,sila diperbarui dan menikmati pembaruan sistem operasi terakhir untuk samsung j
1565,1565,2020-05-13 21:22:27+00:00,"Android 10 One UI 2 mendarat dengan selamat. Pada Samsung J6 datang dengan patch Maret 2020. Yang terasa langsung, Android 10 lebih smooth bila dibanding dengan Pie. https://twitter.com/bayJoee/status/1260206690445611008",samsung,220,28,android one ui mendarat dengan selamat pada samsung j datang dengan patch maret yang terasa langsung android lebih smooth bila dibanding dengan pie
1566,1566,2020-05-13 21:22:22+00:00,Wireless Charger Crystal Round Charging Pad for iPhone X Xs Max XR 8 Plus Samsung Galaxy Note 8 S8 S7 S6 Edge Qi-Enabled Device https://oneinville.com/wireless-charger-crystal-round-charging-pad-for-iphone-x-xs-max-xr-8-plus-samsung-galaxy-note-8-s8-s7-s6-edge-qi-enabled-device-2/,samsung,281,25,wireless charger crystal round charging pad iphone x xs max xr plus samsung galaxy note edge qienabled device
1567,1567,2020-05-13 21:22:17+00:00,"Eu só tive 6 celulares, 3 eu comprei, 1 o plano me deu e 2 eu ganhei e estou ate usando ele que é da LG o que eu tinha era da Samsung Galaxy core 2 que eu fui roubada ",samsung,167,40,eu tive celulares eu comprei plano deu e eu ganhei e estou ate usando ele que da lg que eu tinha era da samsung galaxy core que eu fui roubada
1568,1568,2020-05-13 21:22:15+00:00,YES FINALLY A HAWK POP! And space Hawk to! It almost seems like the contract Samsung had with Epic has expired and Woic now has full controll over Galaxy and his likeness.,samsung,171,32,yes finally hawk pop space hawk almost seems like contract samsung epic expired woic full controll galaxy likeness
1569,1569,2020-05-13 21:22:11+00:00,#Smartphone Shipments Drop to 7-Year Low in Q1 2020 .11.7 % drop in Q12020 @iphone @samsung ,samsung,92,16,smartphone shipments drop year low q drop q
1570,1570,2020-05-13 21:22:09+00:00,"Why doesn't the WW app have the option to sync Samsung trackers to track activity? There are a number of trackers listed on the app to sync, Fitbit, Garmin etc., but not Samsung. Why?",samsung,183,34,doesnt ww app option sync samsung trackers track activity number trackers listed app sync fitbit garmin etc samsung
1571,1571,2020-05-13 21:22:01+00:00,Samsung 64GB Evo Plus MicroSD Card (2 Pack EVO+) Class 10 SDXC Memory Card with Adapter (MB-MC64G) Bundle with (1) Everything But Stromboli Micro ; SD Card Reader ,samsung,163,28,samsung gb evo plus microsd card pack evo class sdxc memory card adapter mbmcg bundle everything stromboli micro sd card reader
1572,1572,2020-05-13 21:21:58+00:00,"Kkkkkkkk. Estavam perguntando se ela estava usando um Samsung, mas eu uso, o meu é antigo e tem uma imagem muito melhor do que o dela. ",samsung,135,26,kkkkkkkk estavam perguntando se ela estava usando um samsung mas eu uso meu antigo e tem uma imagem muito melhor que dela
1573,1573,2020-05-13 21:21:56+00:00,"Oui, justement je regardais un modèle en 34, je pense que c'est plus raisonnable. Et les prix effectivement intéressant. Le nouveau modèle de chez FoxSpirit ( marque de LDLC ) avec dalle Samsung en WQHD 100hz est à seulement 350 euros...",samsung,237,41,oui justement je regardais un modle en je pense que cest plus raisonnable et les prix effectivement intressant le nouveau modle de chez foxspirit marque de ldlc avec dalle samsung en wqhd hz est seulement euros
1574,1574,2020-05-13 21:21:47+00:00,Samsung’s galaxy have Touch ID on the SCREEN.,samsung,45,8,samsungs galaxy touch id screen
1575,1575,2020-05-13 21:21:47+00:00,Wkwk dah kea samsung aj j1 j2 j3 j4 ,samsung,36,9,wkwk dah kea samsung aj j j j j
1576,1576,2020-05-13 21:21:45+00:00,Samsung keyboard,samsung,16,2,samsung keyboard
